[
  {
    "proveedor_id": "660e8400-e29b-41d4-a716-446655440001",
    "nombre_comercial": "CEMEX",
    "razon_social": "CEMEX México S.A. de C.V.",
    "rfc": "CME850101ABC",
    "direccion": "Av. Constitución 444 Pte., Centro, Monterrey, Nuevo León",
    "ciudad": "Monterrey",
    "codigo_postal": "64000",
    "telefono": "81-8888-8888",
    "email": "ventas@cemexmexico.com",
    "contacto_principal": "Ing. Roberto Martínez",
    "banco": "BBVA Bancomer",
    "numero_cuenta": "0123456789",
    "clabe": "012180001234567890",
    "tipo_proveedor": "material",
    "dias_credito": 30,
    "limite_credito": 500000.00,
    "activo": true,
    "created_at": "2024-01-05T08:00:00Z",
    "updated_at": "2024-01-05T08:00:00Z"
  },
  {
    "proveedor_id": "660e8400-e29b-41d4-a716-446655440002",
    "nombre_comercial": "LEVINSON",
    "razon_social": "Aceros Levinson S.A. de C.V.",
    "rfc": "ALE920315XYZ",
    "direccion": "Calz. Vallejo 1020, Col. Santa Cruz de las Salinas, Ciudad de México",
    "ciudad": "Ciudad de México",
    "codigo_postal": "02340",
    "telefono": "55-5555-1234",
    "email": "ventas@levinson.com.mx",
    "contacto_principal": "Lic. Ana Patricia Gómez",
    "banco": "Santander",
    "numero_cuenta": "9876543210",
    "clabe": "014180009876543210",
    "tipo_proveedor": "material",
    "dias_credito": 15,
    "limite_credito": 300000.00,
    "activo": true,
    "created_at": "2024-01-06T09:00:00Z",
    "updated_at": "2024-01-06T09:00:00Z"
  },
  {
    "proveedor_id": "660e8400-e29b-41d4-a716-446655440003",
    "nombre_comercial": "HOME DEPOT",
    "razon_social": "Homer TLC, Inc.",
    "rfc": "HOM030512QRS",
    "direccion": "Periférico Sur 3720, Col. Jardines del Pedregal, Ciudad de México",
    "ciudad": "Ciudad de México",
    "codigo_postal": "01900",
    "telefono": "55-5555-5678",
    "email": "atencion.clientes@homedepot.com.mx",
    "contacto_principal": "Gerente de Ventas",
    "banco": null,
    "numero_cuenta": null,
    "clabe": null,
    "tipo_proveedor": "material",
    "dias_credito": 0,
    "limite_credito": 0.00,
    "activo": true,
    "created_at": "2024-01-07T10:00:00Z",
    "updated_at": "2024-01-07T10:00:00Z"
  },
  {
    "proveedor_id": "660e8400-e29b-41d4-a716-446655440004",
    "nombre_comercial": "INTERCERAMIC",
    "razon_social": "Interceramic S.A. de C.V.",
    "rfc": "INT750820MNO",
    "direccion": "Carr. Saltillo-Monterrey Km 3.5, Ramos Arizpe, Coahuila",
    "ciudad": "Ramos Arizpe",
    "codigo_postal": "25900",
    "telefono": "844-4444-1234",
    "email": "contacto@interceramic.com",
    "contacto_principal": "Ing. Carlos Ruiz",
    "banco": "HSBC",
    "numero_cuenta": "1122334455",
    "clabe": "021180001122334455",
    "tipo_proveedor": "material",
    "dias_credito": 30,
    "limite_credito": 200000.00,
    "activo": true,
    "created_at": "2024-01-08T11:00:00Z",
    "updated_at": "2024-01-08T11:00:00Z"
  },
  {
    "proveedor_id": "660e8400-e29b-41d4-a716-446655440005",
    "nombre_comercial": "BEREL",
    "razon_social": "Pinturas Berel S.A. de C.V.",
    "rfc": "PBE680915PQR",
    "direccion": "Av. Insurgentes Sur 1602, Col. Crédito Constructor, Ciudad de México",
    "ciudad": "Ciudad de México",
    "codigo_postal": "03940",
    "telefono": "55-5555-9012",
    "email": "ventas@berel.com.mx",
    "contacto_principal": "Lic. Martha Jiménez",
    "banco": "Banamex",
    "numero_cuenta": "5544332211",
    "clabe": "002180005544332211",
    "tipo_proveedor": "material",
    "dias_credito": 15,
    "limite_credito": 100000.00,
    "activo": true,
    "created_at": "2024-01-09T12:00:00Z",
    "updated_at": "2024-01-09T12:00:00Z"
  },
  {
    "proveedor_id": "660e8400-e29b-41d4-a716-446655440006",
    "nombre_comercial": "HIERROS SA",
    "razon_social": "Hierros y Materiales S.A. de C.V.",
    "rfc": "HYM910720STU",
    "direccion": "Av. Central 500, Parque Industrial, Tlalnepantla, Estado de México",
    "ciudad": "Tlalnepantla",
    "codigo_postal": "54030",
    "telefono": "55-5555-3456",
    "email": "ventas@hierrosmateriales.com.mx",
    "contacto_principal": "Ing. Fernando López",
    "banco": "Scotiabank",
    "numero_cuenta": "7788990011",
    "clabe": "044180007788990011",
    "tipo_proveedor": "material",
    "dias_credito": 30,
    "limite_credito": 400000.00,
    "activo": true,
    "created_at": "2024-01-10T13:00:00Z",
    "updated_at": "2024-01-10T13:00:00Z"
  }
]
